{
  "id": "b1ed8fd6-ce7a-5a0b-b220-fabd97fe16db",
  "slug": "command-swallow",
  "category": "Command",
  "category_slug": "command",
  "card": "Swallow",
  "subtitle": "Into the Body",
  "symbol": "throat",
  "rarity": "",
  "color": "",
  "hints": [
    "“The word slides deeper than the throat.”",
    "“What enters you cannot be undone.”",
    "“Swallowing seals the suggestion inside.”"
  ],
  "flavor": "",
  "tags": [],
  "extra": {},
  "notes": ""
}