{
  "id": "b579d248-dba5-5cdc-b8ce-72e9710da4f8",
  "slug": "increase-decrease-5",
  "category": "Increase/Decrease",
  "category_slug": "increase-decrease",
  "card": "-5",
  "subtitle": "Decrease Five",
  "symbol": "minus",
  "rarity": "",
  "color": "",
  "hints": [
    "“Everything crumbles at once.”",
    "“Your body resists less, your mind not at all.”",
    "“There is nothing left to subtract.”"
  ],
  "flavor": "",
  "tags": [],
  "extra": {},
  "notes": ""
}