{
  "id": "12391030-370f-5074-853d-64adfdfbcc68",
  "slug": "command-stop",
  "category": "Command",
  "category_slug": "command",
  "card": "Stop",
  "subtitle": "Freeze in Place",
  "symbol": "hand",
  "rarity": "",
  "color": "",
  "hints": [
    "“Her word halts you faster than thought.”",
    "“Even air feels heavy when she says it.”",
    "“Obedience is not hesitation—it is reflex.”"
  ],
  "flavor": "",
  "tags": [],
  "extra": {},
  "notes": ""
}