{
  "id": "564e430e-f32b-5fe0-9164-d63739102d0f",
  "slug": "commands-open",
  "category": "Commands",
  "category_slug": "commands",
  "card": "Open",
  "subtitle": "Unlocked Mind",
  "symbol": "arrow_open",
  "rarity": "",
  "color": "",
  "hints": [
    "“The body opens, but so does the mind.”",
    "“Her voice pushes doors wide without knocking.”",
    "“Opening means receiving, without refusal.”"
  ],
  "flavor": "",
  "tags": [],
  "extra": {},
  "notes": ""
}