{
  "id": "156e98eb-c8e4-5e5f-bcb4-b2f0bfca40af",
  "slug": "induction-covert",
  "category": "Induction",
  "category_slug": "induction",
  "card": "Covert",
  "subtitle": "Hidden Path",
  "symbol": "mask",
  "rarity": "",
  "color": "",
  "hints": [
    "“It sounds casual, but every phrase bends you.”",
    "“The trick of distraction—while the door inside opens.”",
    "“You never noticed you were already following.”"
  ],
  "flavor": "",
  "tags": [],
  "extra": {},
  "notes": ""
}