{
  "id": "32089a64-40d4-51a4-8db7-8394899e0706",
  "slug": "inductions-relaxation",
  "category": "Inductions",
  "category_slug": "inductions",
  "card": "Relaxation",
  "subtitle": "Breath of Calm",
  "symbol": "spiral",
  "rarity": "",
  "color": "",
  "hints": [
    "“Your breath slows… each exhale carries you deeper.”",
    "“A body melting into the chair, the floor, the void.”",
    "“Silence between words becomes the voice itself.”"
  ],
  "flavor": "",
  "tags": [],
  "extra": {},
  "notes": ""
}