{
  "id": "923fe067-9366-5b52-9937-44845eeabbe8",
  "slug": "inductions-rapid",
  "category": "Inductions",
  "category_slug": "inductions",
  "card": "Rapid",
  "subtitle": "Sudden Drop",
  "symbol": "lightning",
  "rarity": "",
  "color": "",
  "hints": [
    "“The snap comes faster than thought.”",
    "“Shock unravels the mind before it can resist.”",
    "“Falling in an instant feels natural.”"
  ],
  "flavor": "",
  "tags": [],
  "extra": {},
  "notes": ""
}