{
  "id": "96d723a3-062c-591f-8caf-e7ccb2d63c5b",
  "slug": "artefact-cappuccino",
  "category": "Artefact",
  "category_slug": "artefact",
  "card": "Cappuccino",
  "subtitle": "The Ritual",
  "symbol": "cup",
  "rarity": "",
  "color": "",
  "hints": [
    "“Foam disguises command.”",
    "“Every sip carries a suggestion.”",
    "“The warmth in your hands is already hers.”"
  ],
  "flavor": "",
  "tags": [],
  "extra": {},
  "notes": ""
}