{
  "id": "14f527e2-d7ca-5cf4-ba2f-6db3fdcc92e8",
  "slug": "induction-fixation",
  "category": "Induction",
  "category_slug": "induction",
  "card": "Fixation",
  "subtitle": "Spiral Flame",
  "symbol": "flame",
  "rarity": "",
  "color": "",
  "hints": [
    "“Eyes held too long, until the blink is surrender.”",
    "“The flicker is not outside, it is behind your eyes.”",
    "“Every circle draws you further inward.”"
  ],
  "flavor": "",
  "tags": [],
  "extra": {},
  "notes": ""
}