{
  "id": "c8e37a00-ae80-52d2-a56f-1e8f357a7960",
  "slug": "command-hold",
  "category": "Command",
  "category_slug": "command",
  "card": "Hold",
  "subtitle": "Dry Orgasm",
  "symbol": "hold",
  "rarity": "",
  "color": "",
  "hints": [
    "“The climax denied becomes a deeper prison.”",
    "“Locked inside, trembling at her mercy.”",
    "“Holding is proof of ownership.”"
  ],
  "flavor": "",
  "tags": [],
  "extra": {},
  "notes": ""
}