{
  "id": "f116e047-abfb-5dc3-a48b-354d9368c3a7",
  "slug": "command-dance",
  "category": "Command",
  "category_slug": "command",
  "card": "Dance",
  "subtitle": "Erection Puppet",
  "symbol": "puppet",
  "rarity": "",
  "color": "",
  "hints": [
    "“Your body moves though you did not choose.”",
    "“Pleasure makes it sway, not you.”",
    "“Her laughter choreographs your arousal.”"
  ],
  "flavor": "",
  "tags": [],
  "extra": {},
  "notes": ""
}