{
  "id": "cca145bf-8629-5c36-9c2b-ec184835543d",
  "slug": "inductions-fractionation",
  "category": "Inductions",
  "category_slug": "inductions",
  "card": "Fractionation",
  "subtitle": "Rise & Fall",
  "symbol": "arrows",
  "rarity": "",
  "color": "",
  "hints": [
    "“Each awakening only makes the drop more delicious.”",
    "“Climb, descend, repeat, until the difference dissolves.”",
    "“The pendulum writes its own command.”"
  ],
  "flavor": "",
  "tags": [],
  "extra": {},
  "notes": ""
}