{
  "id": "fe036a3a-bc94-57b7-a9ce-63f3d70860ee",
  "slug": "commands-snap",
  "category": "Commands",
  "category_slug": "commands",
  "card": "Snap",
  "subtitle": "Pleasure Trigger",
  "symbol": "snap",
  "rarity": "",
  "color": "",
  "hints": [
    "“The crack splits thought from body.”",
    "“Every snap lands where reason cannot.”",
    "“It is the rhythm of control.”"
  ],
  "flavor": "",
  "tags": [],
  "extra": {},
  "notes": ""
}