{
  "id": "aa2d73de-48e8-5adb-9fd9-f3467f0bba1f",
  "slug": "induction-rapid",
  "category": "Induction",
  "category_slug": "induction",
  "card": "Rapid",
  "subtitle": "Sudden Drop",
  "symbol": "lightning",
  "rarity": "",
  "color": "",
  "hints": [
    "“The snap comes faster than thought.”",
    "“Shock unravels the mind before it can resist.”",
    "“Falling in an instant feels natural.”"
  ],
  "flavor": "",
  "tags": [],
  "extra": {},
  "notes": ""
}