{
  "id": "2a074370-2e17-56bc-ab3b-aaaa45f3a536",
  "slug": "command-open",
  "category": "Command",
  "category_slug": "command",
  "card": "Open",
  "subtitle": "Unlocked Mind",
  "symbol": "arrow_open",
  "rarity": "",
  "color": "",
  "hints": [
    "“The body opens, but so does the mind.”",
    "“Her voice pushes doors wide without knocking.”",
    "“Opening means receiving, without refusal.”"
  ],
  "flavor": "",
  "tags": [],
  "extra": {},
  "notes": ""
}