{
  "id": "1a2b95b4-ff41-5e02-8871-f26871d87837",
  "slug": "command-spurt",
  "category": "Command",
  "category_slug": "command",
  "card": "Spurt",
  "subtitle": "Controlled Release",
  "symbol": "spurt",
  "rarity": "",
  "color": "",
  "hints": [
    "“Release only when she wills it.”",
    "“Pleasure obeys command, not urge.”",
    "“Even freedom is framed as obedience.”"
  ],
  "flavor": "",
  "tags": [],
  "extra": {},
  "notes": ""
}