{
  "id": "4464382e-260a-5d36-b9a7-eab4c254de9e",
  "slug": "commands-spurt",
  "category": "Commands",
  "category_slug": "commands",
  "card": "Spurt",
  "subtitle": "Controlled Release",
  "symbol": "spurt",
  "rarity": "",
  "color": "",
  "hints": [
    "“Release only when she wills it.”",
    "“Pleasure obeys command, not urge.”",
    "“Even freedom is framed as obedience.”"
  ],
  "flavor": "",
  "tags": [],
  "extra": {},
  "notes": ""
}