{
  "id": "a0b8fff8-d0f8-5d57-a75f-a7dc4b96f83b",
  "slug": "command-slurp",
  "category": "Command",
  "category_slug": "command",
  "card": "Slurp",
  "subtitle": "Jolt of Pleasure",
  "symbol": "tongue",
  "rarity": "",
  "color": "",
  "hints": [
    "“The sound is obscene, and irresistible.”",
    "“Each sip of hers becomes a throb in you.”",
    "“Slurping is laughing at your weakness.”"
  ],
  "flavor": "",
  "tags": [],
  "extra": {},
  "notes": ""
}