{
  "id": "9a009263-d28f-5aa3-af02-f954cc2215a8",
  "slug": "commands-swallow",
  "category": "Commands",
  "category_slug": "commands",
  "card": "Swallow",
  "subtitle": "Into the Body",
  "symbol": "throat",
  "rarity": "",
  "color": "",
  "hints": [
    "“The word slides deeper than the throat.”",
    "“What enters you cannot be undone.”",
    "“Swallowing seals the suggestion inside.”"
  ],
  "flavor": "",
  "tags": [],
  "extra": {},
  "notes": ""
}